{
  "Name": "English",

  "MustCombine": "You must combine at least %d elements!",
  "MaxCombine": "You can only combine up to %d elements!",
  "DoesntExist": "Element **%s** doesn't exist!",
  "DoesntExistMultiple": "Elements %s don't exist!",
  "DoesntExistJoiner": "and",
  "DontHave": "You don't have **%s**!",
  "DontHaveMultiple": "You don't have %s!",
  "DontHaveJoiner": "or",
  "YouMade": "You made **%s** ðŸ†•",
  "YouHave": "You made **%s**, but already have it ðŸ”µ",
  "ComboNoExist": "That combination doesn't exist! ðŸ”´\n\tSuggest it by typing **/suggest**",
  "$schema": "../schema.json"
}